{
 "phase": "董卓乱政",
 "time_range": "189-08~190-12",
 "world": {
  "summary": "董卓入京把天子当人形公章，废帝、烧洛阳、迁长安一步到位；满朝认爹、诸侯会盟，人人嘴上喊忠汉、心里算地盘——汉室的牌桌被掀了，这局谁都想坐庄。",
  "central_state": "汉室被董卓攥在手里当护身符迁去了长安，天子贬值到只能盖章；朝堂三公九卿集体跪舔相国，王允们在暗处关灯闭门搞刺董串联，诸侯们则把'讨董'当块招牌——先抢到传国玉玺的才是真赢家。"
 },
 "factions": [
  {
   "name": "董卓西凉军",
   "status": "披头散发的西凉野人大军入主洛阳，把帝都当自家后院；相国刚废了少帝立了刘协，正忙着宣布'迁都就在今日'，一把火点了洛阳就要跑。",
   "goals": "以中兴大汉为己任（视小皇帝为唯一亲人），挟天子迁都长安，躲开十八路诸侯的锋芒。",
   "player_relation_default": "weak"
  },
  {
   "name": "洛阳朝堂（汉室）",
   "status": "满朝三公九卿退朝齐喊'臣等恭送董相国'，三公穷到要吕布接济；明面上跪舔相国，暗地里王允'关闭大门、熄掉灯笼、停止奏乐'开忌日寿宴串联刺董。",
   "goals": "保住汉室和自家脑袋，盼着有人能'弹指间取董贼首级悬于长乐宫'。",
   "player_relation_default": "weak"
  },
  {
   "name": "袁绍逃散势力",
   "status": "袁绍跟董卓当庭翻脸拔剑出奔冀州，蹲在韩馥的地盘上攒人；人还没到齐，'十八路诸侯会盟'的旗号已经替他打出去了。",
   "goals": "以盟主身份号令诸侯讨董，顺带惦记传国玉玺和冀州这块肥肉。",
   "player_relation_default": "weak"
  },
  {
   "name": "曹操（陈留起兵）",
   "status": "刺董失败被悬赏千金，中牟捡回条命、屠了吕伯奢一家，回陈留拉起家底；会盟上念假天子诏'比真的更真'，自封讨贼总策划。",
   "goals": "借讨董名头聚兵抢地盘，心里盘算谁先进洛阳谁称王，顺带记住在场每个得罪过他的人。",
   "player_relation_default": "strong"
  },
  {
   "name": "江东孙氏",
   "status": "孙坚在洛阳废墟里捡到传国玉玺，捧着这块'天意实体化'的祸根星夜往江东赶，问题是全天下都知道他捡了宝。",
   "goals": "把玉玺带回江东称帝保太平——结果被袁绍、袁术、刘表轮番盯上，三金渡成了他的终点站。",
   "player_relation_default": "weak"
  },
  {
   "name": "荆州刘表",
   "status": "坐镇襄阳看戏，却跟袁绍眉来眼去，在三金渡给孙坚摆了一出'诈败+吸铁石铠甲'的鸿门宴，还想借袁绍之力向青冀扩展。",
   "goals": "截下传国玉玺、除掉江东猛虎，做大荆州。",
   "player_relation_default": "weak"
  }
 ],
 "locations": [
  {
   "name": "洛阳",
   "type": "capital",
   "status": "两百年的国都，前半程还是董卓的认爹现场，后半程被一把火烧成灰，只剩孙坚军在里面翻传国玉玺。",
   "daily_scenes": [
    "退朝人流里满朝文武齐喊'臣等恭送董相国'，旁边站着一排披头散发的西凉野人",
    "相国府门口，曹操骑匹劣马冲着一群甲士喊'你们就不搜搜看我身上带没带兵刃'，大摇大摆走了进去",
    "王允府上夜里'关闭大门、熄掉灯笼、停止奏乐'开忌日寿宴，宾客凑一块儿痛骂董贼",
    "刺董那晚，七星刀在大铜镜里闪出道激光把董卓晃醒，全城都知道有刺客",
    "迁都后洛阳城一片大火，孙坚军进城在废墟里翻捡，捡出块传国玉玺"
   ]
  },
  {
   "name": "长安",
   "type": "capital",
   "status": "被董卓强行立为'新都'的断壁残垣，黄金军从没打进来过它却'早就是一片瓦砾'；此地问路全靠童谣，时间流速还是全剧最快。",
   "daily_scenes": [
    "官道上挤满被迫西迁的宫人百官，马车里坐着昏睡的貂蝉，吕布一回头就不护驾了",
    "迁都路上随机刷新野生中立伏兵，见人就打，滚木雷石跟投篮似的乱飞",
    "朝堂上董卓宣布'迁都就在今日'，有人拦路就收到'你今天必死无疑'的死亡警告",
    "街头小孩齐唱'东头一个汉，西头一个汉，迁都入长安'，三句错三句"
   ]
  },
  {
   "name": "陈留",
   "type": "city",
   "status": "曹操起兵与会盟的大本营，号称东汉第一食堂兼精神病院，城门口大字却写着'当阳'。",
   "daily_scenes": [
    "十八路诸侯会盟，曹操当众念假天子诏，念得比真的还真",
    "陈留大食堂开饭，十八路诸侯秒变小学生在帅台底下互相架刀斗嘴",
    "袁术攥着十九路诸侯粮饷，刘关张连口热饭都吃不上，张飞直嚷嚷要捅袁术1万个透明窟窿",
    "刘备领了只小马扎坐帅台最末，全程低头盯地板，不知道地上是不是有提词器"
   ]
  },
  {
   "name": "中牟",
   "type": "city",
   "status": "陈宫坐镇的县城，捉放曹的发生地，县衙公堂上斗蛐蛐比审案还热闹。",
   "daily_scenes": [
    "县衙公堂，陈宫一边给蛐蛐打草一边审通缉犯，面瘫曹操冒充'沛国客商皇甫名章'光速被识破",
    "城门口贴着曹操的通缉令，身高被扣到六尺（不到1米4），活像大师兄",
    "深夜大牢里排练越狱，摔蛐蛐罐为号，'碎声一响，闲人退避'",
    "官道两侧蹲满逃难的流民，见生人就要饭，谁路过都先扒一层"
   ]
  },
  {
   "name": "成皋",
   "type": "mountain",
   "status": "虎牢关所在地，城门楼子却挂着'当阳'两个大字；吕布在此一人包围五十万，刘关张在此互相架刀。",
   "daily_scenes": [
    "吕布单骑在关前叫阵'你们十八路诸侯做鼠辈吧'，城楼上十八路诸侯全趴着看相声",
    "华雄半人马在城下叫骂'谁把曹操头颅踢上来，免你们不死'，双重否定当场判人死刑",
    "关羽摸须一刀把华雄连人带马放倒，温酒没喝，'温酒斩华雄'变'无酒斩华雄'",
    "三英战吕布打成刘关张互相架刀，张飞还贴心地科普'三姓家奴'的词义"
   ]
  },
  {
   "name": "颍川",
   "type": "rural",
   "status": "名士之乡，董卓乱政后士人拖家带口往乡野跑，官道上马车连成线，黄金溃兵和假张角也跟着串门。",
   "daily_scenes": [
    "大批士人儒生避乱逃进乡野，田间地头凑一块儿议论'董卓还能蹦跶几天'",
    "官道上偶尔窜出顶着'天公将军张角'名号拦路要香火钱的黄金溃兵",
    "集市上倒卖铁器粮草的马商扎堆，嘴上聊生意，耳朵全竖着听诸侯动向",
    "有落魄名士在村口摆摊算命，掐指一算就说'天意如此'，谁也驳不倒"
   ]
  },
  {
   "name": "冀州",
   "type": "city",
   "status": "袁绍出奔后的落脚地，还是韩馥的地盘；粮草充足、士人投奔，盟主的'宽厚'名声先到一步。",
   "daily_scenes": [
    "袁绍车队扎营，前来投奔的人排着队，他一一以礼相待，宽厚得不像个造反的",
    "'京师人断粮、马无草料'，官道上全是倒卖草料马匹的军需商",
    "各地逃难士人把冀州当避风港，逢人就问'袁盟主几时起兵'",
    "韩馥的地盘上乱不乱不知道，反正袁绍的仁德声望已经提前到账"
   ]
  },
  {
   "name": "江东",
   "type": "river",
   "status": "孙坚的'地盘'，长江航道被荆州军投了水下巨石，传国玉玺正跟着孙坚的船往这儿赶。",
   "daily_scenes": [
    "长江主航道上被人投下几万吨巨石堵路，水手们一脸懵：我看的是三国还是玄幻仙侠",
    "三金渡渡口，刘表摆出诈败假戏，孙坚虎了吧唧地冲锋，差点把刘表老命赔进去",
    "孙坚船里，铠甲跟吸铁石似的，万箭齐发只扎他一个，身边的孙策屁事没有",
    "江东子弟兵在岸边操练，孙策刚立完'三时辰攻下荆州'的豪言，下一秒就瞬移回洞穴"
   ]
  }
 ],
 "characters": [
  {
   "name": "董卓",
   "status": "相国兼洛阳编外城主，废少帝立刘协，正张罗着火烧洛阳迁都长安。",
   "goal": "以中兴大汉为己任，把天子攥在手心里当护身符，躲开十八路诸侯。",
   "personality_notes": "通篇自称'咱家'，一副'大汉忠臣'的做派却纵火焚都；西凉边军被拍成披头散发的野人，他还挺满意这个造型。",
   "player_relation_default": "weak"
  },
  {
   "name": "吕布",
   "status": "董卓义子兼头号打手，城下被刘关张围殴后束发金盔被劈两半，转脸就护着貂蝉策马私奔。",
   "goal": "先弄明白自己为啥是'三姓家奴'，再守护那个一面之缘的貂蝉——义父和天子先放一放。",
   "personality_notes": "率真男儿：武力+100%、智力-250%，敌将骂街他第一反应是虚心请教词义，幼儿园毕业水平。",
   "player_relation_default": "weak"
  },
  {
   "name": "王允",
   "status": "三公却穷得揭不开锅要吕布接济，白天跪董卓，夜里关灯闭门开'忌日寿宴'密谋刺董。",
   "goal": "借刀杀人——把七星刀塞给曹操，赌一个'弹指间取董贼首级悬于长乐宫'。",
   "personality_notes": "贫富倒置的代言人，唱生日=忌日的苦情戏码，戏瘾大过计谋；真假两把七星刀，道具组可能拿错了。",
   "player_relation_default": "weak"
  },
  {
   "name": "曹操",
   "status": "刺董失败被悬赏千金，中牟被陈宫放走，屠了吕伯奢全家后回陈留起兵，会盟上念假诏当上讨贼总策划。",
   "goal": "借讨董聚兵，盘算着先打进洛阳的人说了算，顺带记仇。",
   "personality_notes": "通缉令身高六尺（不到1米4）的'大师兄'，'宁我负天下人'明明是小声密谋却全城广播；刚自称'万余精锐'白嫖了孙坚3000骑兵，东汉反诈大师。",
   "player_relation_default": "strong"
  },
  {
   "name": "袁绍",
   "status": "跟董卓当庭决裂后出奔冀州，蹲在韩馥地盘上被推成十八路盟主，正忙着一脸宽厚地攒人。",
   "goal": "以盟主号令诸侯讨董，背地里惦记传国玉玺，鸿门宴都摆上了。",
   "personality_notes": "宽厚明主天花板：被孙坚拿剑指着也不发火，好脾气到诸侯把他当软柿子；刘备来投奔照样以礼相待。",
   "player_relation_default": "weak"
  },
  {
   "name": "陈宫",
   "status": "中牟县令，当堂擒住钦犯曹操又放了他，摔蛐蛐罐助他越狱，看清'宁我负天下人'后愤而离去。",
   "goal": "找下一个值得辅佐的主公，蛐蛐事业也不能丢。",
   "personality_notes": "虫系宝可梦大师，公堂大牢两不误地斗蛐蛐；东汉人提前一千年玩上了宋代才流行的斗蟋蟀，穿越者石锤。",
   "player_relation_default": "strong"
  },
  {
   "name": "貂蝉",
   "status": "王允义女，被塞进借刀杀人的局里当筹码，迁都路上被吕布从马车里'救'出，两人浪迹天涯。",
   "goal": "被言情剧追着走——反正不用她自己拿主意，昏睡就行。",
   "personality_notes": "三国版睡美人，吕布为了她这个'一面之缘'连义父和天子都不要了；这段言情保质期还有十四集。",
   "player_relation_default": "weak"
  },
  {
   "name": "孙坚",
   "status": "江东猛虎，会盟里唯一真打仗的人，攻进洛阳废墟捡到传国玉玺，捧着祸根往江东赶。",
   "goal": "把玉玺带回江东，以为能凭它称帝保太平——结果在三金渡被万箭穿心。",
   "personality_notes": "脑仁核桃大，密信全靠脑内自动转码（不识字），铠甲是吸铁石做的，万箭齐发只扎他一个。",
   "player_relation_default": "weak"
  },
  {
   "name": "汉献帝",
   "status": "被董卓废掉少帝后扶上位的小皇帝，全程当人质，随'凤驾西行'一路被搬去长安。",
   "goal": "活下去；迁都路上本想靠吕布护驾，结果吕布去守护貂蝉了。",
   "personality_notes": "全剧最没人权的角色，天子也能贬值，与其说是皇帝不如说是传国玉玺的附赠品。",
   "player_relation_default": "weak"
  },
  {
   "name": "袁术",
   "status": "会盟总提调官兼大厨，十九路诸侯的粮饷全攥他手里，正忙着克扣刘关张的粮草。",
   "goal": "谁也不得罪，谁也不给——把粮草攥到自己发霉。",
   "personality_notes": "'袁公路，鲜美无比，不可不尝'，诸侯们差点真把他当军粮吃了；跟袁绍'不能并列于世'，自己人都嫌他多智近妖。",
   "player_relation_default": "weak"
  }
 ],
 "atmosphere": {
  "tone": "chaotic",
  "rumors": [
   "东头一个汉，西头一个汉，迁都入长安——街头小孩都在唱，三句错三句，童谣愣是被唱成了情报站",
   "听说董相国通篇自称'咱家'，李儒自报'常侍李儒'——袁绍明明把太监杀绝了，十常侍这是换了马甲又回来了？",
   "曹操那句'宁可我负天下人'是小声密谋说的，不知怎么就全城广播，现在人人都知道他是杀恩人灭口的狠人",
   "西凉来的兵全是披头散发的野人，有人说是边军，有人说根本就是妖怪下山——反正见谁都要认爹",
   "十八路诸侯在陈留会盟，粮草全捏在袁术手里，听说刘关张仨人连口热饭都吃不上，关羽斩了华雄都没酒喝"
  ],
  "everyday_life": "官道被流民、溃兵和星夜赶路的诸侯车队挤成一条流动的街，前脚刚躲过披头散发的西凉野人，后脚又撞上洛阳到长安之间随机刷新的中立伏兵；洛阳烧成了灰，长安还是一片断壁残垣，老百姓白天讨饭、夜里躲匪，偶尔在陈留大食堂门口蹲着听段'诸侯会盟'的新鲜事，回头盘算谁赢了就跟谁跑。"
 }
}