{
  "phase": "黄金乱起",
  "time_range": "184-02~189-07",
  "world": {
    "summary": "黄金军打着'苍天已死，黄金当立'的招牌从冀州一路烧到颍川，声势大到官军都披了全套铠甲迎战——可惜两拨人马凑一块儿活像一场内部军演，旁白还早早在片头钦点了'第八个月即告平息'，大汉这只鸭子看着扑腾得欢，其实天意爷早把剧本写好了，谁输谁赢都有人兜底。",
    "central_state": "汉室只剩一块金字招牌：汉灵帝卧病在床，宦官与外戚在宫闱里抢班夺权，前线全靠皇甫嵩、朱儁几个老将硬撑；朝廷虽调兵遣将平乱，可官军与黄金军装备一模一样的制式铠甲，打起来分不清敌我，'体重难返'的大汉王朝靠几场胜仗也续不回生机，各地豪强正借'平乱'的名义疯狂扩军捡漏。"
  },
  "factions": [
    {
      "name": "黄金军",
      "status": "正与朝廷官军对垒，盘踞冀州、颍川一带，'苍天已死黄金当立'喊得震天响——可你要在军阵里找个扎黄头巾的，一个都没有，满营全是装备精良的正规军，跟官军站一块儿连彼此都认不出谁打谁。",
      "goals": "推翻汉室让'黄金当立'，实则在颍川正被皇甫嵩的火攻围剿，起义寿命还被旁白钦点成'第八个月即告平息'——旗号打得多响，翻车就有多快。",
      "player_relation_default": "strong"
    },
    {
      "name": "朝廷官军",
      "status": "皇甫嵩、朱儁领衔平乱，兵分颍川、冀州两路，甲光向日晃瞎人眼——可惜跟黄金军一个模子刻出来的制式装备，一场仗下来谁赢全看天意，经常打完仗才发现烧的是自己人。",
      "goals": "赶在'第八个月'的期限前把黄金军镇压下去，给快咽气的大汉王朝续上最后一口气，好向洛阳交差。",
      "player_relation_default": "weak"
    },
    {
      "name": "颍川豪强",
      "status": "战区里把坞堡城墙修到三尺厚，一边躲战乱一边囤积粮草收拢部曲，官军来了当义军捐粮，黄金军来了当信众烧香，两头通吃谁也不得罪。",
      "goals": "保全宗族、趁乱扩大家底，最好能在战后捞个'平乱有功'的匾额，把兵和地都攥进自己家手里。",
      "player_relation_default": "strong"
    },
    {
      "name": "洛阳宫闱集团",
      "status": "汉灵帝卧病在床，宦官与外戚何进在宫闱里斗得你死我活——黄金军在前线打仗，他们在朝堂上争谁说了算，调兵诏书三天两换署名。",
      "goals": "在皇帝咽气前把军权、财权、话语权攥到自己手里，管他黄金军打不打，自己人先分好赃。",
      "player_relation_default": "weak"
    },
    {
      "name": "西凉边军（董卓系）",
      "status": "受诏带凉州兵入中原'协剿'黄金军，到了战场一看这仗打成内部军演，索性按兵不动保存实力，披头散发地在大军后方晃悠，当个吉祥物。",
      "goals": "保存实力、养精蓄锐，坐等洛阳朝局生变好浑水摸鱼——现在这点乱还不够他动窝的。",
      "player_relation_default": "weak"
    },
    {
      "name": "郡国义兵（刘关张系）",
      "status": "各郡自募的乡勇义军，名义上响应朝廷打黄金军，实际上打完就想占个山头或捞个官；刘关张就在其中，可惜整段被旁白'两句话'跳过，没一个人记得他们打过黄金。",
      "goals": "捞军功、博名声、混个一官半职——新三世界乱封官职，入军就敢称'上将军'，谁还在乎你真打过谁。",
      "player_relation_default": "strong"
    }
  ],
  "locations": [
    {
      "name": "颍川",
      "type": "rural",
      "status": "黄金军主战场，官军大营连营十里与黄金军对峙，田野里插满'苍天已死黄金当立'的木牌，皇甫嵩正盘算着一把天火把对面烧成灰。",
      "daily_scenes": [
        "官道两侧蹲满逃难流民，见生人就伸手要饭，嘴里直念叨'黄金军打过来了'——可你要问他们见过黄头巾吗，个个摇头",
        "长社一带夜里忽然冲天大火，皇甫嵩的火攻点着了黄金军营寨——可第二天清点战果，两拨制式装备的正规军混在一起，愣是分不清烧的是谁",
        "地头插着'苍天已死黄金当立'的木牌，字是拿锅底灰写的，比黄金军那贵金属招牌的含金量还实在",
        "路边躺着具披甲的尸首，从头到脚一色官军制式铠甲，腰牌上却刻着'太平道弟子'——这仗验尸都验不明白"
      ]
    },
    {
      "name": "冀州",
      "type": "city",
      "status": "太平道大本营，张角登坛作法坐镇，信众乌泱泱跪满香坛，州郡城门被黄金军把守，但满城找不出一顶黄头巾。",
      "daily_scenes": [
        "郡城街头三步一岗五步一哨全是黄金军，口号喊得震天响，可你要找一顶黄头巾，走遍全城找不着一个",
        "太平道香坛前跪着一片信众，张角登坛求雨求了半天云彩都不来——天意爷说了第八个月平息，谁下雨都不顶用",
        "集市上一升米敢换一袋麦秆，商贩边喊价边往怀里藏刀，嘴上说'太平日子'，手里攥着'太平道'符水",
        "城门口告示三天换一茬：今儿'黄金军必胜'，明儿'官军已退'，落款全是'天公将军'，字迹一天比一天潦草"
      ]
    },
    {
      "name": "洛阳",
      "type": "capital",
      "status": "大汉帝都，表面车水马龙，实则汉灵帝卧病、宦官外戚夺权，百官上朝递交的折子连'黄金军是贼还是义民'都没个准话。",
      "daily_scenes": [
        "宫门外百官排队递折子，内容从'请剿黄金军'到'黄金军实乃义民'应有尽有，谁跟谁说得都不挨着",
        "太庙里供着秦始皇的牌位，皇帝祭祖哭得真情实感，边上太监小声嘀咕'这拜的是咱汉家先皇吗'",
        "禁军换防比翻书还勤，一拨说是外戚何进的人，一拨说是宦官的人，两拨在宫门口碰见就互相瞪眼，谁都不敢先走",
        "酒肆里人人高谈'天意'，三杯下肚就敢指点江山，隔天被扒出来是朝廷细作，又当众喊'吾乃忠臣'——新三的洛阳，人均反贼"
      ]
    },
    {
      "name": "许都",
      "type": "city",
      "status": "颍川边上的县城，夹在战区与后方之间，义军招募棚支了一个月又拆了一个月，客商进城先过三道盘查。",
      "daily_scenes": [
        "城门口守兵挨个盘查过往客商，见着腰挎兵刃的就问'是黄金军还是官军'，被问的人自己也答不上来",
        "城南空地上新搭起一溜义军招募棚，招兵的说'随皇甫将军打黄金军，功成封侯'，招完兵的连夜连人带饷跑路",
        "城内大户把粮食囤进地窖，门口贴'太平道信众在此'，转身又去官府领'平乱义捐'的匾额，两头通吃",
        "县衙门口'报国无门'的帖子贴了撕、撕了贴，落款全是自称'寒士'的游侠，一心想着靠杀黄金军博个前程"
      ]
    },
    {
      "name": "陈留",
      "type": "city",
      "status": "富庶大郡，义兵与游侠汇聚地，号称东汉第一食堂兼精神病院，曹操正领着一支乡勇在城外操练，城门口匾额却写着'当阳'。",
      "daily_scenes": [
        "陈留号称东汉第一食堂，街边大锅炖肉管够，可吃过的人第二天都当上'上将军'——新三世界乱封官职，入军就升官",
        "曹操领着乡勇在城外操练，喊的是'恢复汉室'，练的是自己那套'胜兵必骄、骄兵必败'的十六字兵法，兵卒听得一愣一愣",
        "城门口匾额上写着'当阳'两个大字，过路客商盯着看了半天，也没想明白陈留怎么管自己叫当阳",
        "郡府大堂日夜开堂审案，审的多是'黄金军细作'，十个里有九个是来投军的流民，打一顿又放回去接着招"
      ]
    },
    {
      "name": "中牟",
      "type": "rural",
      "status": "颍川往东的安静小县，官道穿城而过，是南来北往客商的歇脚地，县衙的老爷白天审案夜里斗蛐蛐，日子过得比前线安逸。",
      "daily_scenes": [
        "中牟县衙的老爷白天审案夜里斗蛐蛐，公堂上摆着蛐蛐罐，犯人招供前还得先听他评一句'这虫儿精神头足'",
        "官道驿站挤满了南来北往的客商，聊的全是'张角死了没''皇甫嵩烧到哪了'，谁也没个准信",
        "城头贴的黄金军通缉令配图是张角本人，可底下小字写着'身高六尺，面白无须'——画像师怕是没见过真人",
        "夜里城门提前两个时辰落锁，守卒举着火把查路引，见着没路引的流浪汉就往'太平道香火钱'的名目上敲竹杠"
      ]
    },
    {
      "name": "官渡",
      "type": "river",
      "status": "黄河上的一处渡口，官军粮道和商旅必经之地，水急船少，渡口茶棚里永远坐着几个自称打过仗的老兵在吹牛。",
      "daily_scenes": [
        "官渡渡口的船家见天涨价，理由从'风大'到'黄金军来了'换着花样来，最后加价到半袋子粮才肯开船",
        "黄河对岸黑压压扎着一片大营，走近一看营帐规格跟官军的一模一样——新三的制式大营，谁的兵住进去都是公孙瓒的营",
        "夜里常有船队摸着黑过河，船头挂一盏灯就敢星夜赶路，船家说'星夜加成，人困了马不困'",
        "渡口茶棚里歇脚的老兵说，前阵子一队'官军'从这儿渡河去打'黄金军'，结果那队人自己就是黄金军——听的人都说他吹牛"
      ]
    },
    {
      "name": "新野",
      "type": "rural",
      "status": "荆州边上的小城，颍川流民南逃的第一站，城墙根下挤满了拖家带口的难民，县里大户正开仓施粥赚名声。",
      "daily_scenes": [
        "从颍川逃来的流民拖家带口挤在城墙根下，逢人就说'黄金军打过来啦'，可再问一句'你见过黄头巾吗'，个个摇头",
        "县里大户开仓施粥，粥棚前排队的全是身上带着刀的青壮，喝完了粥转头就去投军——反正打谁都行，谁给饭跟谁",
        "城外荒地一夜之间冒出不少新坟，坟前插的牌子一半写'义士'一半写'乱党'，全靠埋的人当天站哪边"
      ]
    }
  ],
  "characters": [
    {
      "name": "张角",
      "status": "在冀州登坛作法坐镇黄金军，自称'天公将军'，'苍天已死黄金当立'喊得震天响——可惜起义刚开打就被旁白钦点'第八个月即告平息'，满营官兵连个黄头巾都没有。",
      "goal": "让'黄金当立'、把汉室掀翻，最好还能证明自己这天公将军不是满山cosplay的冒牌货。",
      "personality_notes": "折棒盖章的'妖道'——新三世界把他拍成呼风唤雨的降头师，可天意爷连场雨都不给下；更惨的是正主还没凉透，满山强盗已经开始冒用他名号（关羽语：'张角九年前就死了'）。",
      "player_relation_default": "strong"
    },
    {
      "name": "皇甫嵩",
      "status": "朝廷左中郎将，率官军主力在颍川长社与黄金军对峙，正盘算着半夜放一把天火把对面烧成灰。",
      "goal": "赶在'第八个月'的期限前把黄金军剿灭干净，替大汉挣回最后的颜面。",
      "personality_notes": "新三世界里难得的正经老实人——可惜他撞上的是一场'内部军演'：官军和黄金军装备一模一样，打起来分不清敌我，史实那场长社火攻烧的到底是哪边，谁说得清呢。",
      "player_relation_default": "weak"
    },
    {
      "name": "刘备",
      "status": "涿郡落魄宗亲，织席贩履出身，满脑子'兴复汉室'却连支队伍都没有；正琢磨着结义投军，结果整段被旁白'两句话'跳过，黄金之战查无此人。",
      "goal": "找个由头拉起队伍立一番功业，顺带把'仁义'的人设立起来。",
      "personality_notes": "永远低头盯地板说话，像在找地上的提词器；折棒盖章：新三的刘备'既没破过黄金、也没拜过卢植、跟公孙瓒更没半毛钱关系'，功业全靠旁白硬补，苦瓜脸时刻抵抗天意侵蚀。",
      "player_relation_default": "strong"
    },
    {
      "name": "曹操",
      "status": "朝廷任命的讨贼军官，带着乡勇在颍川、陈留一线转悠，满脑子'乱世出英雄'——举手投足透着一种看过剧本的自信。",
      "goal": "借平乱攒兵攒粮攒地盘，等着乱世真正开场时大干一场。",
      "personality_notes": "魏武挥鞭——随地小便都能触发随机事件；'弹指之间'张口就来；折棒吐槽：通缉令上把他扣成不到一米四，这不是曹操，是大师兄。",
      "player_relation_default": "strong"
    },
    {
      "name": "张宝",
      "status": "地公将军，统黄金军主力盘踞颍川一线与皇甫嵩对峙，天天画符念咒等神兵天降。",
      "goal": "守住颍川阵地，别让官军那场火攻得手。",
      "personality_notes": "三兄弟一起cosplay天公地公人公，口号比真金还真，可手下兵一个扎黄头巾的都没有——折棒吐槽：这牌子挂得比黄金军本尊还响。",
      "player_relation_default": "strong"
    },
    {
      "name": "张梁",
      "status": "人公将军，与张宝共守颍川，眼见形势不对开始琢磨往冀州转战保黄金军火种。",
      "goal": "保住黄金军的香火，别让'第八个月'真成了忌日。",
      "personality_notes": "三兄弟里存在感最低的一个，连折棒都懒得单独吐槽他——在新三世界里被'第八个月平息'打包处理，堪称黄金军透明人。",
      "player_relation_default": "weak"
    },
    {
      "name": "董卓",
      "status": "凉州军阀，受诏带西凉兵入中原'协剿'黄金军，到了战场一看是内部军演，干脆按兵不动保存实力，披头散发地在西线晃悠。",
      "goal": "保存实力、坐等洛阳朝局生变，好带着这身'大汉忠臣'的皮再往上爬一步。",
      "personality_notes": "自诩'大汉忠臣'，实际上兵强马壮谁也不服；折棒吐槽：西凉人只是边军不是蛮夷，怎么就全员披头散发的野人造型——到了新三，董卓就顶着这身野人皮等着进京。",
      "player_relation_default": "weak"
    },
    {
      "name": "袁绍",
      "status": "四世三公的名门公子，在洛阳朝堂谋事，正琢磨怎么借着平乱的名头捞点军功声望。",
      "goal": "借黄金军之乱在朝野站稳脚跟，攒声望攒班底。",
      "personality_notes": "极宽厚仁德，随机圣明或昏庸；说话爱打太极——'听君一席话，如听一席话'；折棒盖章：欲显本初长厚而似伪。",
      "player_relation_default": "weak"
    },
    {
      "name": "关羽",
      "status": "河东看门护院出身，一身武艺正愁没处使，黄金之战没他的份，只能东一榔头西一棒子地找活儿干。",
      "goal": "寻一个识货的主公，把这身本事卖个好价钱。",
      "personality_notes": "永远眯着丹凤眼一副没睡醒的样子，缺乏与人交互能力，见谁都是一张冷脸——折棒吐槽：导演八成把'丹凤眼'人设拍成了'丹凤眼没睡醒'。",
      "player_relation_default": "weak"
    },
    {
      "name": "陈宫",
      "status": "中牟一带的县吏，白天审案夜里斗蛐蛐，满心想着'这乱世该有人来收拾'，就等一个能成事的明主。",
      "goal": "找个能成事的明主，好把自己这一肚子主意卖出去。",
      "personality_notes": "虫系宝可梦大师，蛐蛐罐不离手，公堂大牢两不误——折棒吐槽：东汉人斗的是始唐盛宋才流行的蛐蛐，这陈宫怕不是个穿越者。",
      "player_relation_default": "weak"
    }
  ],
  "atmosphere": {
    "tone": "chaotic",
    "rumors": [
      "黄金军发饷真的发黄金——可见过的人都说，那'金子'就是刀枪，接上手就得跟他们干仗，不接就是叛徒",
      "天公将军张角会呼风唤雨，在冀州一登坛，官军那边天都黑半截",
      "皇甫嵩要在长社放一把天火把黄金军烧个精光——官军大营里人人都这么说，说完自己先怕了",
      "涿郡那边传，有三兄弟要在桃园结拜打天下——可新三世界里这事得等董卓进京才真发生，现在传的纯属提前剧透"
    ],
    "everyday_life": "壮劳力被官军和黄金军轮流拉去当民夫，田荒了大半，剩下的人白天进城讨饭、夜里躲进山沟过夜，连灯都不敢点——生怕被当成给乱党举火的；集市上一升米换一袋麦秆还抢着换，财主家却把粮食囤得发霉，穷人拿地契换一顿饱饭；朝廷的告示贴了又撕，总写着'贼势已平，天下太平'，可城外天天都在死人，有人还在大冬天赶着播种，说是等来年丰收——能不能活到那时候，谁心里都没底。"
  }
}
