{
  "phase": "群雄割据",
  "time_range": "191-04~199",
  "world": {
    "summary": "讨董联军散伙之后没人再提'兴复汉室'——各路军阀把传国玉玺当抽卡道具，今天你捅我一刀，明天我啃你一口，天下像一桌没人洗牌的麻将，人人都想当庄，谁坐庄谁先挨打。",
    "central_state": "汉室从'被董卓烧'变成'被曹操端汤接走'：献帝从李傕郭汜手里逃出来，一路东归饿得半死，最后被曹操一锅鸡汤迎回许都软禁起来；皇帝的头衔成了各路诸侯手里最值钱的'奉天子以令不臣'广告位——名义上的天下共主，实际是个供各家刷名分的道具，且在这世界里'汉室宗亲'还是卑贱的代名词。"
  },
  "factions": [
    {
      "name": "曹操",
      "status": "挟着汉献帝坐镇许都，左手发'奉天子'矫诏、右手割发代首，正满世界给各路诸侯封官递请帖（袁术称帝、吕布徐州牧……一个都没到账），一边说'剑指天子，但我忠心耿耿啊'。",
      "goals": "先收拾称帝的袁术，再把徐州的吕布、荆州的刘表挨个盘一遍，最后连河北的袁绍一起办了——反正'优势在我'。",
      "player_relation_default": "strong"
    },
    {
      "name": "袁绍",
      "status": "雄踞冀州，四世三公的门面还在发光，口号喊得震天响'地广民丰、带甲百万'；最近为打不打曹操翻来覆去睡不着，一夜之间白了大半个头。",
      "goals": "稳住河北四州的基本盘，攒够兵马粮草，找个'曹操先动手'的体面理由再开打，最好还能保住'宽厚明主'的名声。",
      "player_relation_default": "weak"
    },
    {
      "name": "袁术",
      "status": "刚捧着传国玉玺在自家地盘登基当上骷髅王，自称大汉正统，还把脑袋伸进玉玺的降智光环里照镜子，非说自己年过花甲（实际才四十出头）。",
      "goals": "娶吕布女儿当儿媳妇（聘礼能拖一年不兑现）、派使者四方'结亲'拉盟友，让全天下都承认他这个'仲氏天子'。",
      "player_relation_default": "weak"
    },
    {
      "name": "吕布",
      "status": "坐镇徐州这座'中原第一雄关'，认爹技术天下第一（亲爹+丁原+董卓+王允，四姓家奴的buff叠满），军师陈宫替他把账算，他负责在阵前虚心请教'我为何成了三姓家奴'。",
      "goals": "在曹操、刘备、袁术三家之间来回横跳，谁给粮给酒就跟谁结盟——最好是不用站队就白吃三家的饭。",
      "player_relation_default": "strong"
    },
    {
      "name": "刘备",
      "status": "借住小沛，跟吕布互相认兄弟又互相提防，日常领着关张种菜、卖草鞋补贴军费，见谁都一副忠厚老实脸，转头就琢磨怎么把徐州弄到手。",
      "goals": "找一块真正属于自己的根据地——徐州、小沛、荆州，哪里有空缺就往哪儿钻，顺便给自己攒'仁义'的人设。",
      "player_relation_default": "strong"
    },
    {
      "name": "刘表",
      "status": "守着荆州'天上人间'当土皇帝，永远六十四岁，体弱多病却死活不死；蔡瑁已经快把他架空，他还在一脸慈祥地装病收租。",
      "goals": "保住荆州九郡谁都不许碰，谁打架他当和事佬——最好全天下打成一锅粥的时候，他安安静静把税收到手。",
      "player_relation_default": "weak"
    }
  ],
  "locations": [
    {
      "name": "许都",
      "type": "capital",
      "status": "曹操一锅鸡汤端给饿半年的天子、把人迎回来的新帝都；长乐宫按'每城一家'的老规矩连锁经营，街上处处是相府眼线，老百姓说话都得防着'二人密谋必被窃听'的定律。",
      "daily_scenes": [
        "宫门口排着等曹操接见的各路使者，个个举着自家'投名状'，生怕排不上号",
        "朝会上一半大臣在跪舔丞相，一半躲在厕所里密谋衣带诏——密谋要不出声，要不干脆去厕所，厕所屏蔽外界感知",
        "曹操骑着马满城遛弯，看谁顺眼就当街给人家封个'奋威将军'，乱封官职跟发传单似的",
        "城门口贴着一张'天子贬值'的行情表：接驾一次送侯爵，骂董卓一次送校尉，童叟无欺"
      ]
    },
    {
      "name": "徐州",
      "type": "city",
      "status": "陶谦三让气绝后由刘备、吕布、曹操轮流坐庄的'中原第一雄关'，四战之地，谁占着都得防另外三家半夜摸过来偷家。",
      "daily_scenes": [
        "城门守兵挨个盘查过往客商，张口就问'你是曹公的人还是吕公的人'，答错了直接当细作拖走",
        "酒馆里满桌在传'吕布辕门射戟射偏了照样算命中'的八卦，满营上下集体失明，谁都不敢戳穿天意",
        "街头常有一队披麻戴孝的流民（陶谦同款造型）边哭边把城池往外让，让完一座又一座",
        "徐州、小沛、许都之间全靠'新三国道'传送，前一秒还在城里喝酒，后一秒城门就换成别家的"
      ]
    },
    {
      "name": "小沛",
      "type": "rural",
      "status": "徐州城的卫星，绕着徐州公转的'进徐点/远徐点'，有时离徐州一晚上就到，有时得走好几天——全看它今天转到哪个位置；刘备和吕布把这儿当临时落脚点，互相防着。",
      "daily_scenes": [
        "一队'刘皇叔'的兵在城外种菜，脸上还糊着泥，说是韬光养晦",
        "城门楼上明明挂着'小沛'的牌匾，可你要是迷路，转个弯说不定就撞见城门上'当阳'两个大字（新三地理全靠瞬移）",
        "粮车来来往往，全是陶谦老规矩'每年敬送二十万粮饷'的续费单，谁在这儿驻军谁就白吃",
        "夜里常有吕布的斥候摸到城外打探，问完就跑——反正卫星城天天在动，报告交上去也没人信位置"
      ]
    },
    {
      "name": "冀州",
      "type": "city",
      "status": "袁绍的大本营，'地广民丰带甲百万'喊得震天响；最近袁绍为官渡的事一夜白头，城里文臣武将正为'打不打曹操'吵得不可开交。",
      "daily_scenes": [
        "府衙前文武百官分成两拨对骂，一边喊'优势在我'，一边喊'田丰刚而犯上'，吵到半夜谁也不服谁",
        "田丰、许攸等谋士轮着被袁绍传唤，昨儿还'此计大妙'，今儿就'杖二十军棍'",
        "冀州大营的营帐长得全一模一样——新三'制式大营'，不管谁出门住哪儿都是公孙瓒那套配置",
        "街边老汉蹲墙角嗑瓜子，讨论袁绍今儿是'宽厚明主'还是'昏君'——这机制随机生效，今天圣明明天昏庸"
      ]
    },
    {
      "name": "荆州",
      "type": "city",
      "status": "刘表治下的'天上人间'，能压制天下无敌效果的风水宝地；蔡瑁快把刘表架空了，可刘表依然一脸慈祥地装病，永远六十四岁。",
      "daily_scenes": [
        "襄阳江边画舫上坐着'永远64岁'的刘表，一边咳血一边说他今年刚过四旬",
        "蔡瑁家的粮船把荆州粮草一船船运走，账本上写的全是'修缮宫殿'的名义",
        "路过襄阳的流亡文人越来越多，都在传'刘表病危、荆州不久便是无主之城'",
        "江面上漂着荆州军用来堵长江航道的水下巨石，像一块块符文墓碑，什么时候撤什么时候放全看蔡瑁心情"
      ]
    },
    {
      "name": "官渡",
      "type": "river",
      "status": "黄河边上的渡口，眼下还是南北对峙的前哨，曹操和袁绍都在往这儿囤粮草，两边的探子互相蹲点，就等哪天正式开打。",
      "daily_scenes": [
        "黄河渡口挤满两边派来的斥候，互相装不认识，其实名字早报给对面头头了",
        "成队的粮船日夜往北往南运，船工一边摇橹一边嘀咕'听说河北那边的粮山堆到天上了'",
        "渡口茶馆里坐着几个'客商'，一个是曹操的细作，一个是袁绍的细作，聊到high处差点报出自家主公名号",
        "官道两旁蹲满逃难的流民，见生人就要饭，手里攥着半块没发霉的饼"
      ]
    },
    {
      "name": "长安",
      "type": "capital",
      "status": "被董卓烧完又被李傕郭汜抢走的废都，王允献了城跳了楼，天子被拎走，现在城里是西凉兵和'认二哥'的野人武将的天下，号令乱成一锅粥。",
      "daily_scenes": [
        "满街都是披头散发的西凉兵，见人就喊'咱家'，活像刚从山里野人村出来",
        "李傕郭汜今儿称兄道弟，明儿就为谁当老大翻脸，城门上的旗号一礼拜换三回",
        "城头常有文官揣着朝服追着乱军喊'住手！'，十万兵马还真说停就停",
        "百姓家里供着'秦始皇牌位'，祭拜汉朝先皇都得先拜他老人家——汉朝太庙供奉的是嬴政"
      ]
    },
    {
      "name": "洛阳",
      "type": "city",
      "status": "被董卓一把火烧成废墟的百年国都，焦黑的宫殿还冒着细烟，各路诸侯的捡漏队在这儿翻找没烧完的官印字画；偶尔还有野生中立伏兵在废墟里随机刷新。",
      "daily_scenes": [
        "瓦砾堆里钻着捡'国难财'的商人，专收诸侯们抢剩下的官印、字画",
        "残破的宫墙下蹲着一排叫花子，号称'前朝三公'，管路过的人要饭",
        "洛阳到长安的大道上，每隔十里就刷新一伙见人就打的'野生中立伏兵'，不分阵营照打不误",
        "荒草里立着一块半焦的碑，字迹被火烧得认不全，就成了各路说书人现编故事的素材"
      ]
    }
  ],
  "characters": [
    {
      "name": "曹操",
      "status": "挟天子坐镇许都，日常一边发矫诏给各路诸侯封官，一边盘算先灭谁；爹死了老婆死了都能乐出声，剑指天子还自称忠心耿耿。",
      "goal": "先收拾袁术、吕布，再盯上河北的袁绍，用'奉天子以令不臣'的名分把天下一个个吞进肚。",
      "personality_notes": "新三头号精神病：能一本正经说'当君子就要被践踏，所以我宁可做奸雄'，还抢在杨修前面二十年喊出'世人皆在梦中'；被观测时属性随机变化（世人看错），随时随地准备割发代首。",
      "player_relation_default": "strong"
    },
    {
      "name": "袁绍",
      "status": "冀州之主，带甲百万，正为讨不讨曹操翻来覆去睡不着，一头青丝一夜白了大半。",
      "goal": "攒足河北四州的兵和粮，找个体面的理由跟曹操开战——最好是曹操先动手，他好占住'仁义'。",
      "personality_notes": "'宽厚明主'随机生效的薛定谔君主：今天圣明到听田丰的话，明天昏庸到要砍田丰的头；自带死亡抗性II能死三次，官渡一败还能以僵尸形态返场。",
      "player_relation_default": "weak"
    },
    {
      "name": "刘备",
      "status": "借住小沛，领着关张种菜糊口，见谁都一脸忠厚；刚跟吕布拜了把子，转头就在琢磨怎么把徐州弄到手。",
      "goal": "找一块真正属于自己的地盘——徐州、小沛、荆州，哪里有空缺就往哪儿钻，顺便攒'仁义'的名声。",
      "personality_notes": "新三头号'忠厚人'：种菜韬光养晦还往脸上抹土，被雷声吓得掉筷子还硬装淡定；大耳朵自带'心灵控制'，专唆使别人替自己干不仁不义的事，自己永远一脸无辜。",
      "player_relation_default": "weak"
    },
    {
      "name": "吕布",
      "status": "雄踞徐州，认爹四连（亲爹/丁原/董卓/王允），最近又跟刘备、袁术同时称兄道弟，收了袁术二十万粮饷转头在辕门射箭劝架。",
      "goal": "在曹、刘、袁三家之间来回横跳，谁给粮给酒就跟谁好，保住徐州这块'中原第一雄关'。",
      "personality_notes": "武力+100%智力-250%的率真男儿，敌将骂他三姓家奴他还虚心请教为什么；辕门射戟射偏了也能靠世界意志算命中，满营集体失明没一个敢戳穿。",
      "player_relation_default": "strong"
    },
    {
      "name": "孙策",
      "status": "接了孙坚的班，带着江东子弟在江东开疆拓土，号称'小霸王'，正满世界放话说要取荆州、打许都。",
      "goal": "平定江东六郡，攒够兵马好替父报仇、跟中原的曹操碰一碰——反正先放狠话再说。",
      "personality_notes": "新三'三体星人'：打完仗瞬移回上一个镜头的山洞，动不动就'激昂'附体；狂话说'三个时辰擒刘表攻克荆州'，地理常识约等于零，还自带降智光环（跟他爹孙坚学的）。",
      "player_relation_default": "weak"
    },
    {
      "name": "陈宫",
      "status": "吕布的军师，虫系宝可梦大师，一边给吕布出馊主意一边喂蛐蛐；从董卓、曹操一路'跳槽'到吕布，誓死要当个君子。",
      "goal": "让吕布在曹、刘、袁的夹缝里活下来并做大，顺便跟曹操这个'奸雄'死磕到底。",
      "personality_notes": "中牟县放走过曹操又看清他真面目的'蛐蛐王'；一身正气全喂了蛐蛐，临死前还要在曹操面前当众直播他的黑历史——'我料你曹孟德也不会杀我老母'，说得曹操都乐了。",
      "player_relation_default": "strong"
    },
    {
      "name": "刘表",
      "status": "坐镇荆州当'天上人间'的土皇帝，永远六十四岁，体弱多病却死不下去；蔡瑁快把他架空，他还在一脸慈祥地装病收租。",
      "goal": "保住荆州九郡不让外人染指，谁打起来都当和事佬，最好是全天下打仗他一个人收税。",
      "personality_notes": "新三'长寿挂'选手：永远64岁、自带'不能成为杀和决斗目标'效果，他的病像薛定谔的猫，说好就好说坏就坏，反正荆州迟早是别人的。",
      "player_relation_default": "weak"
    },
    {
      "name": "皇甫嵩",
      "status": "平过黄巾的老资格名将，如今在长安朝堂上挂着虚衔，被李傕郭汜当吉祥物供着，想说话又没人听。",
      "goal": "趁着乱世想再拉起一支队伍重整旗鼓，可惜手上没兵没权，只能眼看天下越打越烂。",
      "personality_notes": "老资历看尽新三乱象：他当年平黄巾的时候可没这么多'传送门''火焰流星雨'，如今连小兵都学会开着传送门打仗了，他只能叹一句'世风日下'。",
      "player_relation_default": "weak"
    },
    {
      "name": "曹丕",
      "status": "曹操的幼子，日常被亲爹当弼马温使唤——曹操一个口哨，他就得屁颠屁颠跑来牵马。",
      "goal": "好好给爹当儿子，指望哪天熬出头继承家业——不过在曹操眼里，儿子跟部将一样都是'下人极珍贵'时代的稀缺资源。",
      "personality_notes": "新三'召唤系'儿子：曹操吹哨子他就凭空刷新出来牵马，换个场景又是别人家的使者；从小学着爹的腔调跟各路叔叔谈笑风生，一副'我爹天下第一'的底气。",
      "player_relation_default": "weak"
    }
  ],
  "atmosphere": {
    "tone": "chaotic",
    "rumors": [
      "曹操屠徐州那回，当面说好'不屠城'，转头就传令'男女老幼斩尽杀绝'——老百姓被算成战俘，不产粮只耗粮，天下哪有这种道理",
      "吕布在辕门射戟射偏了，画戟的吊穗儿都给射中，可满营上下愣是没一个敢说他射歪——那是天意，天意懂吗",
      "袁术捧着传国玉玺照了照镜子，非说自己年过花甲，可我见他满打满算才四十出头——摸过玉玺的人脑子都废了",
      "曹操夜里睡觉假意'梦中杀人'，杀完近侍第二天就一传十十传百，全天下都知道丞相的床不能靠近",
      "汉献帝在厕所里私会刘备哭了一场，半个时辰后全城都在传'皇叔要反曹'——想保密？去厕所，厕所屏蔽"
    ],
    "everyday_life": "普通人在这个乱世的日常：青壮被一拨拨拉去充军，今天跟着曹操打吕布，明天跟着袁术打曹操，昨天还并肩的袍泽今天就在对面举刀；老弱妇孺拖家带口往没打仗的州跑，路上还要防着官道旁蹲着要饭的流民和不知从哪儿刷新的伏兵。田里的庄稼一半被兵踩一半被抢，剩下那点还得交'军饷粮'；家里的男人出门打听消息，回来就说哪家又屠城了、哪个诸侯又认爹了、谁家又捡到传国玉玺了——大家早已见怪不怪，只在冬天照样往地里播种，等着来年长出点能吃的，运气好的话，据说是荀彧说的，田亩里还能长出兵马。"
  }
}
