{
  "phase": "天下三分",
  "time_range": "220-01~223+",
  "world": {
    "summary": "曹丕在许都受禅坛逼汉献帝禅位、代汉建魏，刘备在成都称帝续汉、伐吴夷陵大败后崩于白帝城，孙权以'大魏吴王'之姿坐山观虎——四百年汉室落幕，魏蜀吴三国鼎立正式成形，天下进入三家互掐、谁都想吞掉另外两家的时代。",
    "central_state": "汉献帝刘协被一辞再辞三辞的禅让大戏逼下龙椅，封为山阳公，凿船自沉未遂被曹后救下；四百年汉室在受禅坛上正式了账，如今只剩许都太庙里供着的秦始皇牌位和几位骂不出口的旧臣。"
  },
  "factions": [
    {
      "name": "曹魏",
      "status": "曹丕代汉称帝，正逢'王椅比龙座还大'的草台班子朝廷：追尊曹操为武皇帝、给孙权册封大魏吴王，老将新臣都在排队等封赏，五路伐蜀箭在弦上。",
      "goals": "灭蜀吞吴一统天下，先稳住孙权再收拾刘备，把'篡汉'洗成'顺天应人'。",
      "player_relation_default": "weak"
    },
    {
      "name": "蜀汉",
      "status": "夷陵一把火把七十万大军烧成灰，白帝托孤后诸葛亮独揽大权，正在休养生息、张罗北伐，民间被四六征税三丁抽一刮得地皮薄了三尺。",
      "goals": "先跟东吴重结盟好缓口气，再攒钱粮兵甲北伐曹魏，把'汉贼不两立'的口号喊到底。",
      "player_relation_default": "weak"
    },
    {
      "name": "东吴",
      "status": "刚在夷陵打赢，孙权领了'大魏吴王'的封号，可江东之主的权限在大都督手里来回倒腾，满城权谋家忙着互相背锅、装病归隐。",
      "goals": "守住江东基业，在魏蜀之间两头下注，捞最大便宜又不真下场当炮灰。",
      "player_relation_default": "weak"
    },
    {
      "name": "汉室遗忠",
      "status": "散落在山阳、许都的旧臣宦官，嘴上还念叨'汉贼不两立'，实际能做的只剩偷偷溜进太庙对着秦始皇牌位骂曹丕。",
      "goals": "盼着有人再造大汉，或者至少看见曹家祖坟被刨得干净一点。",
      "player_relation_default": "strong"
    },
    {
      "name": "益州旧臣（李严系）",
      "status": "以李严为首的蜀中降臣党，靠劝刘备称帝、主张四六征税上了位，正跟诸葛亮明争暗夺丞相手里的权力。",
      "goals": "把诸葛亮手里的权挤掉一点是一点，让蜀中旧人拿回话语权。",
      "player_relation_default": "strong"
    }
  ],
  "locations": [
    {
      "name": "许都",
      "type": "capital",
      "status": "受禅坛刚落成，曹丕在此登基改元，太庙还供着秦始皇牌位，满城都在传'王椅比龙座大'、太监喊退朝的笑话。",
      "daily_scenes": [
        "受禅坛广场的木匠正赶制比龙座还大的王椅，老太监没事就学一句'退朝'，把百官喊得一愣一愣。",
        "太庙里供着秦始皇牌位，偶有旧臣摸黑来烧纸，求祖宗保佑曹家早点断子绝孙。",
        "城门守兵挨个盘查过往客商，人人都传东吴细作混在送礼队里打听'大魏吴王'的封号能不能兑现。",
        "茶馆说书人讲曹操遗命七十二座疑冢，台下一片哄笑：人都死了还怕盗墓，先王也太看得起自己了。",
        "司马懿府门前车马络绎，曹丕三天两头微服上门，街坊都说这位相国大人三寸肉舌能劝人交兵权。"
      ]
    },
    {
      "name": "成都",
      "type": "capital",
      "status": "蜀汉国都，刘备称帝后正厉兵秣马，四六征税三丁抽一的告示贴满城，诸葛亮在府中昼夜人体炼成补兵。",
      "daily_scenes": [
        "四六征税、三丁抽一的告示贴在城门口，里正挨家点名，壮丁名册一车一车往外送，百姓见人就喊苦。",
        "丞相府后院日夜冒烟，说是孔明在'人体炼成'——钱粮进去、精兵出来，军需官排队领新兵。",
        "东宫天天传出背书声，太子阿斗背《高祖本纪》背到'遂产高祖'这种断句，先生气得直拍桌子。",
        "街上有人倒卖关羽画像，说陛下夜里对着画像说话，还传闻画像能通阴阳、跟二爷隔空下棋。",
        "丞相的四轮车从街上碾过，百姓跪了一路，心里却嘀咕：这丞相到底在忧虑什么，自己也说不清。"
      ]
    },
    {
      "name": "建业",
      "type": "capital",
      "status": "吴都，孙权刚封'大魏吴王'就挂了病中谢客的牌子，满城都在传江东之主轮流坐、大都督宿命的闲话。",
      "daily_scenes": [
        "孙权府上挂了'病中谢客'的牌子，可江边船帮都知道主公没病，是在躲大都督的权谋风暴。",
        "张昭馆驿前常有旧臣串门，人人都在猜下一任江东之主是谁，说这头衔跟大都督一样是轮着坐的。",
        "江上运来一车车传国夜明珠和奇珍异宝，说是要上贡给大魏，账房先生直摇头：这礼单也太薄了。",
        "牢里关着刚来投奔的范疆张达，百姓拍手称快：杀了张飞想投吴，反手就被主公下狱，这就是降将的下场。",
        "茶馆里都在传夷陵那把火——陆逊一把火烧掉七十万蜀军，说书人一拍醒木：这就是大都督的宿命啊！"
      ]
    },
    {
      "name": "汉中",
      "type": "mountain",
      "status": "禁魔领域，当年黄忠百万大军在此平推定军山、曹操的兵法机制全被封印，如今是诸葛亮北伐的大本营，百万雄兵屯驻各隘口。",
      "daily_scenes": [
        "禁魔领域里连法术都失灵，老卒还在讲定军山旧事：黄忠平推夏侯渊、曹操在此一败涂地。",
        "诸葛亮炼的百万雄兵有一半驻在汉中各隘口，兵营一望无际，军需官说这就是蜀汉的命根子。",
        "官道上军粮车昼夜不停往东运，车夫说丞相要北伐了，第一站就是陈仓、街亭这些第一雄关。",
        "山道险要处常埋伏着野生中立伏兵，不分阵营见人就打，商队宁可绕远路也不敢夜过山沟。"
      ]
    },
    {
      "name": "洛阳",
      "type": "capital",
      "status": "曹魏的新都，曹操刚在此殡天、遗命疑冢七十二处，城里还留着'死是凉爽的夏夜'的临终吟诵余音，华佗被'拿下'后生死不明。",
      "daily_scenes": [
        "邙山脚下新起了七十二座疑冢，盗墓贼成群结队摸黑转悠，谁也不知道曹操到底埋在哪一座。",
        "华佗医馆大门紧锁，门上贴着'神医'的匾，街坊传他被魏王拿下后生死不明——在新三国，生死不明就是死了。",
        "茶馆里有人学曹操临终念'死不可怕，死是凉爽的夏夜'，念完哈哈大笑：先王最后还整上现代诗了。",
        "官道上来往的多是给新朝廷递贺表的使者，人人揣着一份给曹丕的劝进书，生怕跑得比同僚慢。"
      ]
    },
    {
      "name": "荆州",
      "type": "river",
      "status": "东吴新得之地，新三国道的核心传送门开在江边渡口，天上人间的旧匾还在，是魏吴蜀三家的战略咽喉。",
      "daily_scenes": [
        "新三国道的核心传送门就开在江边渡口，客商排着队钻进去，出来就到许都或建业，日行百里不是梦。",
        "当年水淹七军的大水退了，江边还泡着沉船和甲胄，渔民一网下去能捞上几支曹军箭头。",
        "东吴新设的荆州官府挂着'天上人间'的旧匾，本地人直撇嘴：这地方现在归吴王管，乐不思蜀的戏码又得重演。",
        "江面上常有'白衣渡江'的船队夜行，说是吕蒙留下的水军遗产，可惜大都督已经换了两任。"
      ]
    },
    {
      "name": "麦城",
      "type": "rural",
      "status": "关羽自刎归天之地，立着'汉故寿亭侯'的新碑，村民说夜里常听见关羽之歌的调子，是天意在给名场面结算。",
      "daily_scenes": [
        "关羽自刎归天的地方立着块新碑，碑文是'汉故寿亭侯'，路过的商队和游客都要停下来鞠个躬。",
        "麦城城头还插着半截青龙偃月刀的残片，胆大的兵痞想撬走，被同乡拦住：二爷的刀你也敢动？",
        "夜里风声像关羽之歌，村民说这是天意在给名场面结算，谁碰谁倒霉，连野狗都绕着走。",
        "田野里散落着当年突围时的箭矢和破甲，有拾荒人靠着捡这些废铁发了笔小财。"
      ]
    }
  ],
  "characters": [
    {
      "name": "曹丕",
      "status": "刚在许都受禅坛登基改元，追尊曹操为武皇帝，正磨刀霍霍准备伐蜀，还要时刻防着亲爹临终点名的司马懿。",
      "goal": "坐稳大魏天下，找机会吞蜀并吴，把'篡汉'洗成'承天受命'。",
      "personality_notes": "A5二言绝句+精神病之力继承者；折棒梗：王椅比龙座还大、退朝自己喊、一辞再辞三辞全演给天下人看，连七步诗都要靠华歆人肉计数器报步数。",
      "player_relation_default": "weak"
    },
    {
      "name": "刘备",
      "status": "成都称帝后率七十万大军伐吴，连营七百里扎进山林，被陆逊一把火烧得只身逃回白帝城，靠阿斗的智商决定跟东吴重结盟。",
      "goal": "在自刎归天之前，把桃园三兄弟的仇和仁之剑义之剑的债都了结。",
      "personality_notes": "A5灵魂锁链+自刎归天；折棒梗：刘关张实则不熟、他压根不想为关羽报仇只想摆烂，四六征税三丁抽一压榨蜀民还美其名曰'恩惠'。",
      "player_relation_default": "weak"
    },
    {
      "name": "诸葛亮",
      "status": "白帝城托孤后独揽蜀汉大权，天天担心自己不知道在担心什么，正在张罗安居平五路和北伐，顺便用人体炼成补兵。",
      "goal": "保住蜀汉气运、北伐曹魏，同时消化掉先帝留下的这一摊烂账和那个清澈愚蠢的太子。",
      "personality_notes": "A5人体炼成+无端忧虑+向下霸凌马谡；折棒梗：天意小抄看不懂就瞎忧虑，嘴上'哀哉痛哉'心里早盼着刘备死，好自己接盘当蜀汉之主。",
      "player_relation_default": "strong"
    },
    {
      "name": "孙权",
      "status": "夷陵打赢后当上'大魏吴王'，却整天装病归隐、满城背着关羽张飞的锅，江东之主的权限刚捂热又还给陆逊。",
      "goal": "坐稳江东之主，在魏蜀之间两头下注，别让大都督把权全夺走。",
      "personality_notes": "A5江东之主轮流坐+大都督诅咒；折棒梗：孙权凡战必败所以专上前线帮陆逊叠buff，范疆张达杀了张飞来投反被下狱，他说自己只想关起门玩权谋。",
      "player_relation_default": "weak"
    },
    {
      "name": "司马懿",
      "status": "曹丕跟前红得发紫，刚用三寸肉舌劝得曹彰交出兵权，正筹划五路伐蜀，被曹操临终点名'用他但必须防他'。",
      "goal": "吃透天意剧本，把大魏江山一点点搬进司马家，还不想背劝进的黑锅。",
      "personality_notes": "A5天意本意+化骨绵掌；折棒梗：卖汉室卖得理直气壮、又当又立，私下劝进、公开不做首倡大臣，怕后人刨司马氏祖坟。",
      "player_relation_default": "weak"
    },
    {
      "name": "关羽",
      "status": "已在麦城自刎归天，首级被孙权当寿礼送去许昌，新三国道旁立了座墓碑，英灵偶尔还跟刘备隔空下棋。",
      "goal": "头可断发型不能乱，把美髯公形象保持到最后一刻。",
      "personality_notes": "A5摸须一刀斩+一气化三清；折棒梗：关羽零人头、临死灵魂出窍还摆造型，亲口说过'自尽便是懦夫'转头就自刎归天，人均记不住自己上一秒的话。",
      "player_relation_default": "strong"
    },
    {
      "name": "曹操",
      "status": "建安二十五年正月在洛阳殡天，遗命疑冢七十二处、愿改嫁者准其改嫁，死后还凭天意把遗书传回过去成了诸葛亮的祭文。",
      "goal": "把基业传给嘴硬的曹丕，顺便给天意留个'我曹操最懂你'的印象。",
      "personality_notes": "A5魏武挥鞭+二言绝句+世人看错；折棒梗：临死吟海涅现代诗、弹指神通坐化，大佐口音配精神病之力，'我从来不怕别人看错我'说了十几遍。",
      "player_relation_default": "strong"
    },
    {
      "name": "陆逊",
      "status": "东吴大都督，在夷陵用连营神技拖住刘备，一把火把七十万蜀军烧回白帝城，赛博坦基建能力天下第一。",
      "goal": "守住大都督之位别被孙权毒死，顺便把主公欠的那点面子还上。",
      "personality_notes": "A5擎天柱赛博坦+火无敌继承周瑜；折棒梗：建营寨没有CD、'我自有三十万雄兵从天而降'，结果那三十万指的是酷暑疫病和瘴气。",
      "player_relation_default": "weak"
    },
    {
      "name": "张飞",
      "status": "在阆中督造白盔白甲准备随主出征，结果被挨了两百鞭的范疆张达割了脑袋，首级连同凶手一起被孙权收下。",
      "goal": "带兵杀进东吴替二哥报仇，躲过灵魂锁链的结算。",
      "personality_notes": "A5酿制美酒包治百病+一夫当关；折棒梗：鞭打金刚狼、打完转头拉人喝酒，范疆张达挨两百鞭'一鞭都不能少'，最终双双下线，全剧平均含人量瞬间提升。",
      "player_relation_default": "weak"
    },
    {
      "name": "汉献帝",
      "status": "禅位后被封山阳公，凿穿渡船想自沉殉国被曹后救下，如今在山阳种田，偶尔回许都太庙对着秦始皇牌位骂曹家。",
      "goal": "保命苟活之余，盼着有朝一日有人能替他把曹丕收拾了。",
      "personality_notes": "A5汉朝太庙供奉秦始皇+长乐宫连锁；折棒梗：退朝时满朝无人理、自己喊退朝，一掌把曹后推出内伤'龙气内功'，曹后还喊'请鞭笞我吧陛下'。",
      "player_relation_default": "strong"
    }
  ],
  "atmosphere": {
    "tone": "fatalistic",
    "rumors": [
      "许都传着'王椅比龙座还大'的闲话——曹丕受禅那日，太监自作主张喊'退朝'，满朝只有汉献帝一人走下大殿。",
      "民间都说曹操没死，是'生死不明'地躲进了七十二座疑冢，还有人赌他那些改嫁的媳妇儿到底嫁没嫁成。",
      "白帝城方向夜里常传'自刎归天'的口号声，蜀中老卒说先帝是被阿斗背《高祖本纪》背到'遂产高祖'给气死的。",
      "夷陵山沟里挖出过'赛博坦'的营寨图纸，乡民说陆逊建营寨没有冷却，盖得比拆得还快。",
      "长安到洛阳的官道上闹鬼，赶路的客商说半夜能听见'接着奏乐接着舞'和'死是凉爽的夏夜'。"
    ],
    "everyday_life": "三国百姓的日子被天意和兵灾夹着过：蜀地按'四六征税、三丁抽一'交粮，壮丁刚填进夷陵的火里，老人妇女就得上地补税粮；魏境官道两侧蹲满逃难流民，见生人就讨饭，城门守兵挨个盘查过往客商生怕混进细作；江东江边人家一边传着'大都督宿命'的闲话，一边盼着东吴别又换主公；夜里无论哪座城，总有人念叨'换大盏'——酒是唯一能暂时顶住天意侵蚀、让人安睡一晚的东西。"
  }
}
